### ISSUE TITLE
[Bug]: Exporting to opentsdb fails with v1.35.0-137-nightly

### ISSUE THREAD

**Issue by schmyd** [netdata/netdata#13333]
### Bug description

I observed the following bug when switching vom v.1.34 to v1.35.0-145-nightly. Metric export to influxdb (v1.8) via opentsdb doesn't work anymore. Data never appears in the influxdb database, no error logs on influxdb or netdata visible. The only visible trace were frequent warnings via alarms - contrary to the green indication: no data was ever received in influxdb
![image](https://user-images.githubusercontent.com/1061814/177809724-60b06957-dfa9-42e4-a166-37af2b9f0413.png)

To investigate, I ran tcpdump on the influxdb container: `tcpdump host netdata.docker-data_default and port 4242 -A -N --direction in`

With netdata v1.34 the data looks like
```
15:02:49.189909 IP netdata.52560 > bac45cc38c94.4242: Flags [P.], seq 3563065:3563168, ack 449, win 502, options [nop,nop,TS val 4266845745 ecr 1924289979], length 103
E...c.@.@.~r.......     .P...v./........X......
.R.1r.U.POST /api/put HTTP/1.1
Host: influxdb:4242
Content-Type: application/json
Content-Length: 510239


15:02:49.189982 IP netdata.52560 > bac45cc38c94.4242: Flags [P.], seq 3563168:3570408, ack 449, win 502, options [nop,nop,TS val 4266845745 ecr 1924289979], length 7240
E..|c.@.@.b........     .P...v..........t......
.R.1r.U.[
{"metric":"netdata.cgroup_upbeat_lichterman.cpu_limit.used","timestamp":1657206150,"value":0.2000000,"tags":{"host":"host1"}},

...until

{"metric":"netdata.netdata.statsd_metrics.sets","timestamp":1657206200,"value":0.0000000,"tags":{"host":"host2"}}
]
```

However with v1.35 I receive the following (notice the comma after host1, and that there is no host2 data present)
```
15:10:55.449164 IP netdata.47274 > bac45cc38c94.4242: Flags [P.], seq 0:103, ack 1, win 502, options [nop,nop,TS val 4267332004 ecr 1924786178], length 103
E.....@.@..........     .....s.3.!......X......
.ZQ.r...POST /api/put HTTP/1.1
Host: influxdb:4242
Content-Type: application/json
Content-Length: 583122


15:10:55.449183 IP netdata.47274 > bac45cc38c94.4242: Flags [P.], seq 103:7343, ack 1, win 502, options [nop,nop,TS val 4267332004 ecr 1924786178], length 7240
E..|..@.@..........     .....s...!......t......
.ZQ.r...[
{"metric":"netdata.cgroup_murmur.cpu_limit.used","timestamp":1657206640,"value":0.0000000,"tags":{"host":"host1",}},
...
# no host2 data here
```

### Expected behavior

Data should be exported as in v1.34

### Steps to reproduce

1. Change exporting.conf to write to opentsdb database via http without authorization
2. Optional: Receive data from another node (host2) configured via stream.conf
3. Check if data appears in opentsdb database
4. Check if alarms are triggered

### Installation method

docker

### System info

```shell
Linux host1 5.4.174-2-pve #1 SMP PVE 5.4.174-2 (Thu, 10 Mar 2022 15:58:44 +0100) x86_64 Linux
/etc/alpine-release:3.16.0
/etc/os-release:NAME="Alpine Linux"
/etc/os-release:ID=alpine
/etc/os-release:VERSION_ID=3.16.0
/etc/os-release:PRETTY_NAME="Alpine Linux v3.16"
```

### Netdata build info

```shell
Version: netdata v1.35.0-145-nightly
Configure options:  '--prefix=/usr' '--sysconfdir=/etc' '--localstatedir=/var' '--libexecdir=/usr/libexec' '--libdir=/usr/lib' '--with-zlib' '--with-math' '--with-user=netdata' '--without-bundled-protobuf' '--disable-dependency-tracking' '--with-bundled-libJudy' '--disable-ebpf' 'CFLAGS=-O2 -pipe' 'LDFLAGS='
Install type: unknown
Features:
    dbengine:                   YES
    Native HTTPS:               YES
    Netdata Cloud:              YES
    ACLK Next Generation:       YES
    ACLK-NG New Cloud Protocol: YES
    ACLK Legacy:                NO
    TLS Host Verification:      YES
    Machine Learning:           YES
    Stream Compression:         YES
Libraries:
    protobuf:                YES (system)
    jemalloc:                NO
    JSON-C:                  YES
    libcap:                  NO
    libcrypto:               YES
    libm:                    YES
    tcalloc:                 NO
    zlib:                    YES
Plugins:
    apps:                    YES
    cgroup Network Tracking: YES
    CUPS:                    NO
    EBPF:                    NO
    IPMI:                    YES
    NFACCT:                  NO
    perf:                    YES
    slabinfo:                YES
    Xen:                     NO
    Xen VBD Error Tracking:  NO
Exporters:
    AWS Kinesis:             NO
    GCP PubSub:              NO
    MongoDB:                 YES
    Prometheus Remote Write: YES
```

### Additional info

exporting.conf (relevant part)
```
[opentsdb:http:influxdb]
    enabled = yes
    destination = influxdb:4242
    # data source = average
    # prefix = netdata
    hostname = host1
    # update every = 10
    # buffer on failures = 10
    # timeout ms = 20000
    # send names instead of ids = yes
    # send charts matching = *
    # send hosts matching = localhost *
```

logs show that exporting is enabled (localhost=host1)
```
netdata         | 2022-07-07 15:26:45: netdata INFO  : EXPORTING : enabled exporting of host 'localhost' for instance 'influxdb'
netdata         | 2022-07-07 15:26:45: netdata INFO  : EXPORTING : enabled exporting of host 'host2' for instance 'influxdb'
```

Otherwise no changes between v1.34 and v1.35

**Comment by schmyd** [comment]
can confirm it's working. Thanks guys
