### ISSUE TITLE
Netdata can't talk to VictoriaMetrics

### ISSUE THREAD

**Issue by agrimal** [netdata/netdata#10567]
##### Bug report summary

Sending metrics doesn't work when configuring VictoriaMetrics as destination for prometheus_remote_write exporter.
It is working with Netdata v1.24.0 and older with the old `[backend]` section in `/etc/netdata/netdata.conf`.
It is not working since v1.25.0.
I tried with 1.28.0 and 1.28.217, installed both with .deb packages.

Here are the relevant logs from netdata :
```
/var/log/netdata/error.log:2021-01-29 13:00:06: netdata INFO  : EXPORTING : thread with task id 3792 finished
/var/log/netdata/error.log:2021-01-29 13:00:06: netdata INFO  : EXPORTING : thread created with task id 4865
/var/log/netdata/error.log:2021-01-29 13:00:06: netdata INFO  : EXPORTING : set name of thread 4865 to EXPORTING
/var/log/netdata/error.log:2021-01-29 13:00:06: netdata INFO  : EXPORTING : Processing connector instance (victoriametrics)
/var/log/netdata/error.log:2021-01-29 13:00:06: netdata INFO  : EXPORTING : Instance (victoriametrics) on connector (prometheus_remote_write) is enabled and scheduled for activation
/var/log/netdata/error.log:2021-01-29 13:00:06: netdata INFO  : EXPORTING : Instance victoriametrics on prometheus_remote_write
/var/log/netdata/error.log:2021-01-29 13:00:14: netdata INFO  : EXPORTING : enabled exporting of host 'localhost' for instance 'victoriametrics'
/var/log/netdata/error.log:2021-01-29 13:00:29: netdata ERROR : MAIN : EXPORTING: cannot receive data from 'victoria-metrics1-inter.mydomain.org:8480 victoria-metrics2-inter.mydomain.org:8480'. (errno 104, Connection reset by peer)
/var/log/netdata/error.log:2021-01-29 13:00:29: netdata ERROR : MAIN : EXPORTING: 'victoria-metrics1-inter.mydomain.org:8480 victoria-metrics2-inter.mydomain.org:8480' closed the socket
/var/log/netdata/error.log:2021-01-29 13:00:44: netdata ERROR : MAIN : EXPORTING: cannot receive data from 'victoria-metrics1-inter.mydomain.org:8480 victoria-metrics2-inter.mydomain.org:8480'. (errno 104, Connection reset by peer)
/var/log/netdata/error.log:2021-01-29 13:00:44: netdata ERROR : MAIN : EXPORTING: 'victoria-metrics1-inter.mydomain.org:8480 victoria-metrics2-inter.mydomain.org:8480' closed the socket

```

And the tcpdump trace on the VictoriaMetrics server :
```
13:00:14.620483 IP nextcloud-inter.mydomain.org.60752 > victoria-metrics1-inter.mydomain.org.8480: Flags [S], seq 3881647754, win 62020, options [mss 8860,sackOK,TS val 2495005064 ecr 0,nop,wscale 7], length 0
13:00:14.620576 IP victoria-metrics1-inter.mydomain.org.8480 > nextcloud-inter.mydomain.org.60752: Flags [S.], seq 78808271, ack 3881647755, win 61936, options [mss 8860,sackOK,TS val 646329251 ecr 2495005064,nop,wscale 7], length 0
13:00:14.620977 IP nextcloud-inter.mydomain.org.60752 > victoria-metrics1-inter.mydomain.org.8480: Flags [.], ack 1, win 485, options [nop,nop,TS val 2495005064 ecr 646329251], length 0
13:00:14.621079 IP nextcloud-inter.mydomain.org.60752 > victoria-metrics1-inter.mydomain.org.8480: Flags [P.], seq 1:287, ack 1, win 485, options [nop,nop,TS val 2495005064 ecr 646329251], length 286
13:00:14.621119 IP victoria-metrics1-inter.mydomain.org.8480 > nextcloud-inter.mydomain.org.60752: Flags [.], ack 287, win 482, options [nop,nop,TS val 646329252 ecr 2495005064], length 0
13:00:14.621175 IP nextcloud-inter.mydomain.org.60752 > victoria-metrics1-inter.mydomain.org.8480: Flags [.], seq 287:26831, ack 1, win 485, options [nop,nop,TS val 2495005064 ecr 646329251], length 26544
13:00:14.621191 IP victoria-metrics1-inter.mydomain.org.8480 > nextcloud-inter.mydomain.org.60752: Flags [.], ack 26831, win 379, options [nop,nop,TS val 646329252 ecr 2495005064], length 0
13:00:14.632907 IP nextcloud-inter.mydomain.org.60752 > victoria-metrics1-inter.mydomain.org.8480: Flags [.], ack 150, win 484, options [nop,nop,TS val 2495005075 ecr 646329253], length 0
13:00:14.632957 IP victoria-metrics1-inter.mydomain.org.8480 > nextcloud-inter.mydomain.org.60752: Flags [R], seq 78808421, win 0, length 0


13:00:29.599786 IP nextcloud-inter.mydomain.org.60764 > victoria-metrics1-inter.mydomain.org.8480: Flags [S], seq 1197846162, win 62020, options [mss 8860,sackOK,TS val 2495020043 ecr 0,nop,wscale 7], length 0
13:00:29.599869 IP victoria-metrics1-inter.mydomain.org.8480 > nextcloud-inter.mydomain.org.60764: Flags [S.], seq 3267535711, ack 1197846163, win 61936, options [mss 8860,sackOK,TS val 646344230 ecr 2495020043,nop,wscale 7], length 0
13:00:29.600012 IP nextcloud-inter.mydomain.org.60764 > victoria-metrics1-inter.mydomain.org.8480: Flags [.], ack 1, win 485, options [nop,nop,TS val 2495020043 ecr 646344230], length 0
13:00:29.600054 IP nextcloud-inter.mydomain.org.60764 > victoria-metrics1-inter.mydomain.org.8480: Flags [P.], seq 1:287, ack 1, win 485, options [nop,nop,TS val 2495020043 ecr 646344230], length 286
13:00:29.600065 IP victoria-metrics1-inter.mydomain.org.8480 > nextcloud-inter.mydomain.org.60764: Flags [.], ack 287, win 482, options [nop,nop,TS val 646344231 ecr 2495020043], length 0
13:00:29.600077 IP nextcloud-inter.mydomain.org.60764 > victoria-metrics1-inter.mydomain.org.8480: Flags [.], seq 287:26831, ack 1, win 485, options [nop,nop,TS val 2495020043 ecr 646344230], length 26544
13:00:29.600089 IP victoria-metrics1-inter.mydomain.org.8480 > nextcloud-inter.mydomain.org.60764: Flags [.], ack 26831, win 379, options [nop,nop,TS val 646344231 ecr 2495020043], length 0
13:00:29.600161 IP nextcloud-inter.mydomain.org.60764 > victoria-metrics1-inter.mydomain.org.8480: Flags [P.], seq 26831:30456, ack 1, win 485, options [nop,nop,TS val 2495020043 ecr 646344231], length 3625
13:00:29.600170 IP victoria-metrics1-inter.mydomain.org.8480 > nextcloud-inter.mydomain.org.60764: Flags [.], ack 30456, win 351, options [nop,nop,TS val 646344231 ecr 2495020043], length 0
13:00:29.600389 IP victoria-metrics1-inter.mydomain.org.8480 > nextcloud-inter.mydomain.org.60764: Flags [P.], seq 1:150, ack 30456, win 351, options [nop,nop,TS val 646344231 ecr 2495020043], length 149
13:00:29.600445 IP victoria-metrics1-inter.mydomain.org.8480 > nextcloud-inter.mydomain.org.60764: Flags [R.], seq 150, ack 30456, win 443, options [nop,nop,TS val 646344231 ecr 2495020043], length 0
13:00:29.600566 IP nextcloud-inter.mydomain.org.60764 > victoria-metrics1-inter.mydomain.org.8480: Flags [.], ack 150, win 484, options [nop,nop,TS val 2495020044 ecr 646344231], length 0
13:00:29.600588 IP victoria-metrics1-inter.mydomain.org.8480 > nextcloud-inter.mydomain.org.60764: Flags [R], seq 3267535861, win 0, length 0


13:00:44.619340 IP nextcloud-inter.mydomain.org.60770 > victoria-metrics1-inter.mydomain.org.8480: Flags [S], seq 3970059643, win 62020, options [mss 8860,sackOK,TS val 2495035063 ecr 0,nop,wscale 7], length 0
13:00:44.619384 IP victoria-metrics1-inter.mydomain.org.8480 > nextcloud-inter.mydomain.org.60770: Flags [S.], seq 1686094432, ack 3970059644, win 61936, options [mss 8860,sackOK,TS val 646359250 ecr 2495035063,nop,wscale 7], length 0
13:00:44.619999 IP nextcloud-inter.mydomain.org.60770 > victoria-metrics1-inter.mydomain.org.8480: Flags [.], ack 1, win 485, options [nop,nop,TS val 2495035063 ecr 646359250], length 0
13:00:44.620037 IP nextcloud-inter.mydomain.org.60770 > victoria-metrics1-inter.mydomain.org.8480: Flags [P.], seq 1:287, ack 1, win 485, options [nop,nop,TS val 2495035063 ecr 646359250], length 286
13:00:44.620047 IP victoria-metrics1-inter.mydomain.org.8480 > nextcloud-inter.mydomain.org.60770: Flags [.], ack 287, win 482, options [nop,nop,TS val 646359251 ecr 2495035063], length 0
13:00:44.620078 IP nextcloud-inter.mydomain.org.60770 > victoria-metrics1-inter.mydomain.org.8480: Flags [.], seq 287:26831, ack 1, win 485, options [nop,nop,TS val 2495035063 ecr 646359250], length 26544
13:00:44.620090 IP victoria-metrics1-inter.mydomain.org.8480 > nextcloud-inter.mydomain.org.60770: Flags [.], ack 26831, win 379, options [nop,nop,TS val 646359251 ecr 2495035063], length 0
13:00:44.620132 IP nextcloud-inter.mydomain.org.60770 > victoria-metrics1-inter.mydomain.org.8480: Flags [P.], seq 26831:30552, ack 1, win 485, options [nop,nop,TS val 2495035063 ecr 646359251], length 3721
13:00:44.620140 IP victoria-metrics1-inter.mydomain.org.8480 > nextcloud-inter.mydomain.org.60770: Flags [.], ack 30552, win 351, options [nop,nop,TS val 646359251 ecr 2495035063], length 0
```

##### OS / Environment

```
OS : Debian 10 Buster
Kernel : 4.19.0-13-amd64
Netdata version : v1.28.0-217-nightly (installed with .deb)
VMinsert version : vminsert-20200923-004417-tags-v1.41.1-cluster-0-g90d254942
```

#### Configuration :

/etc/netdata/netdata.conf
```ini
[global]
    run as user = netdata
    web files owner = root
    web files group = netdata
    history = 3600
    memory mode = save

[registry]
    enabled = no
    registry to announce = https://live-metrics-registry.mydomain.org

[statsd]
    enabled = no

[plugins]
    tc = no
    node.d = no
    freeipmi = no
    ebpf = no

[plugin:proc:/proc/net/dev]
    drops for all interfaces = no
```

/etc/netdata/exporting.conf
```ini
[prometheus_remote_write:victoriametrics]
    enabled = yes
    destination = localhost
    remote write URL path = /receive
    destination = victoria-metrics1-inter.mydomain.org:8480 victoria-metrics2-inter.mydomain.org:8480
    remote write URL path = /insert/1/prometheus/api/v1/write
    data source = as collected
    prefix = netdata
    update every = 15
    timeout ms = 10000
    send charts matching = *
    send hosts matching = *
    send names instead of ids = yes
```

/etc/systemd/system/vminsert.service
```ini
[Unit]
Description=Victoria Metrics - Insert Daemon
Requires=network.target network-online.target
After=network.target network-online.target
Documentation=https://github.com/VictoriaMetrics/VictoriaMetrics

[Service]
Type=simple
User=victoria-metrics
Group=victoria-metrics
StartLimitBurst=5
StartLimitInterval=0
Restart=on-failure
RestartSec=10
WorkingDirectory=/var/lib/victoria-metrics
EnvironmentFile=/etc/default/vminsert
ExecStart=/usr/sbin/vminsert -envflag.enable -envflag.prefix=VM_
ExecStop=/bin/kill -s SIGTERM $MAINPID
LimitNOFILE=65536
LimitNPROC=32000

[Install]
WantedBy=multi-user.target
```

/etc/default/vminsert
```bash
VM_httpListenAddr="0.0.0.0:8480"
VM_loggerLevel="INFO"
VM_memory_allowedPercent="60"
VM_loggerDisableTimestamps="1"
VM_loggerOutput="stdout"
VM_rpc_disableCompression="1"
VM_storageNode="victoria-metrics1-inter.mydomain.org:8400,victoria-metrics2-inter.mydomain.org:8400"
```

**Comment by vlvkobal** [comment]
What I did:
```
docker run -it --rm -v /tmp/victoria-metrics-data:/victoria-metrics-data -p 8428:8428 victoriametrics/victoria-metrics
```
`exporting.conf`:
```
[prometheus_remote_write:my_prometheus_remote_write_instance]
    enabled = yes
    destination = localhost:8428
    remote write URL path = /api/v1/write
    prefix = netdata
    send charts matching = system.processes
```
The data is in its place:
```
curl 'http://localhost:8428/render?target=netdata_system_processes_processes_average&format=json'
[{"target":"netdata_system_processes_processes_average","tags":{"chart":"system.processes","dimension":"blocked","family":"processes","instance":"arch-esxi","name":"netdata_system_processes_processes_average"},"datapoints":[[0,1612519418],[0,1612519421],[0,1612519424],[0,1612519427],[0,1612519430],[0,1612519433],[0,1612519436],[0,1612519439],[0,1612519442],[0,1612519445],[0,1612519448],[0,1612519451],[0,1612519454],[0,1612519457],[0,1612519460],[0,1612519463],[0,1612519466],[-0.333333333333,1612519469],[0,1612519472],[0,1612519475],[0,1612519478],[-0.333333333333,1612519481],[0,1612519484],[0,1612519487],[0,1612519490],[0,1612519493],[0,1612519496],[0,1612519499],[0,1612519502],[0,1612519505],[0,1612519508],[0,1612519511],[0,1612519514],[0,1612519517],[0,1612519520],[0,1612519523],[0,1612519526],[0,1612519529],[0,1612519532],[0,1612519535],[0,1612519538],[0,1612519541],[0,1612519544],[0,1612519547],[0,1612519550],[0,1612519553],[0,1612519556],[0,1612519559],[0,1612519562],[0,1612519565],[0,1612519568],[0,1612519571],[-0.333333333333,1612519574],[0,1612519577],[0,1612519580]]}]
```
I believe you misconfigured something. BTW, you have duplicate options in `exporting.conf`:
```
    destination = localhost
    remote write URL path = /receive
    destination = victoria-metrics1-inter.mydomain.org:8480 victoria-metrics2-inter.mydomain.org:8480
    remote write URL path = /insert/1/prometheus/api/v1/write
```
I'm closing the issue. If you have other questions please continue at https://community.netdata.cloud.

**Comment by agrimal** [comment]
OK @vlvkobal I found the problem.
Before you switched from backend to exporting configuration (1.24 -> 1.25), the prometheus_remote_write exporter allowed the configuration of several servers as destination in an active/backup way.
It seems not possible anymore.
If I put one server, everything is fine, but with 2 servers it's nort working.
Is it intended or a regression ?
