### ISSUE TITLE
Not 5 pings per host for plugin of fping?

### ISSUE THREAD

**Issue by startryst** [netdata/netdata#7620]
##### Question summary
In the fping.conf, I see there will be 5 pings per host for any round as below:
```
# The time in milliseconds (1 sec = 1000 ms) to ping the hosts
# by default 5 pings per host per iteration
# fping will not allow this to be below 20ms
```
But what I observed from the dashboard, is looks like 2 pings for each round, am I right?
![Screen Shot 2019-12-25 at 10 45 26 AM](https://user-images.githubusercontent.com/22472752/71429862-c31c0500-2703-11ea-9af3-f795b3687f0b.jpg)

Also, it looks the fping plug-in is hard coded of loop mode, can I change it back to count mode, so I can just how many pings per round, or there's a parameter to adjust, or this is a feature request?

##### OS / Environment
CentOS 7
##### Component Name
Plug-in fping

**Comment by ilyam8** [comment]
Hi @startryst 

> Also, it looks the fping plug-in is hard coded of loop mode

from the `man fping`

> -N, --netdata
Format output for netdata (-l -Q are required). See: <http://my-netdata.io/>

> -l -Q are required

**Comment by startryst** [comment]
> Hi @startryst
> 
> > Also, it looks the fping plug-in is hard coded of loop mode
> 
> from the `man fping`
> 
> > -N, --netdata
> > Format output for netdata (-l -Q are required). See: http://my-netdata.io/
> 
> > -l -Q are required

Yeah, but it looks not 5 pings per round, so is it possible to make 5 pings each round? 5 will be good for me.

**Comment by ilyam8** [comment]
It is 5 (see timestamps)

```console
test@DEB10-1:~$ sudo tcpdump -n -i enp0s3 dst 8.8.4.4
tcpdump: verbose output suppressed, use -v or -vv for full protocol decode
listening on enp0s3, link-type EN10MB (Ethernet), capture size 262144 bytes
02:35:21.145847 IP 10.0.2.15 > 8.8.4.4: ICMP echo request, id 15288, seq 3125, length 64
02:35:21.346240 IP 10.0.2.15 > 8.8.4.4: ICMP echo request, id 15288, seq 3126, length 64
02:35:21.546613 IP 10.0.2.15 > 8.8.4.4: ICMP echo request, id 15288, seq 3127, length 64
02:35:21.746654 IP 10.0.2.15 > 8.8.4.4: ICMP echo request, id 15288, seq 3128, length 64
02:35:21.947122 IP 10.0.2.15 > 8.8.4.4: ICMP echo request, id 15288, seq 3129, length 64

02:35:22.147449 IP 10.0.2.15 > 8.8.4.4: ICMP echo request, id 15288, seq 3130, length 64
02:35:22.347823 IP 10.0.2.15 > 8.8.4.4: ICMP echo request, id 15288, seq 3131, length 64
02:35:22.547998 IP 10.0.2.15 > 8.8.4.4: ICMP echo request, id 15288, seq 3132, length 64
02:35:22.748066 IP 10.0.2.15 > 8.8.4.4: ICMP echo request, id 15288, seq 3133, length 64
02:35:22.948229 IP 10.0.2.15 > 8.8.4.4: ICMP echo request, id 15288, seq 3134, length 64

02:35:23.148474 IP 10.0.2.15 > 8.8.4.4: ICMP echo request, id 15288, seq 3135, length 64
02:35:23.348846 IP 10.0.2.15 > 8.8.4.4: ICMP echo request, id 15288, seq 3136, length 64
02:35:23.549134 IP 10.0.2.15 > 8.8.4.4: ICMP echo request, id 15288, seq 3137, length 64
02:35:23.749520 IP 10.0.2.15 > 8.8.4.4: ICMP echo request, id 15288, seq 3138, length 64
02:35:23.949819 IP 10.0.2.15 > 8.8.4.4: ICMP echo request, id 15288, seq 3139, length 64
```

**Comment by startryst** [comment]
> It is 5 (see timestamps)
> 
> ```
> test@DEB10-1:~$ sudo tcpdump -n -i enp0s3 dst 8.8.4.4
> tcpdump: verbose output suppressed, use -v or -vv for full protocol decode
> listening on enp0s3, link-type EN10MB (Ethernet), capture size 262144 bytes
> 02:35:21.145847 IP 10.0.2.15 > 8.8.4.4: ICMP echo request, id 15288, seq 3125, length 64
> 02:35:21.346240 IP 10.0.2.15 > 8.8.4.4: ICMP echo request, id 15288, seq 3126, length 64
> 02:35:21.546613 IP 10.0.2.15 > 8.8.4.4: ICMP echo request, id 15288, seq 3127, length 64
> 02:35:21.746654 IP 10.0.2.15 > 8.8.4.4: ICMP echo request, id 15288, seq 3128, length 64
> 02:35:21.947122 IP 10.0.2.15 > 8.8.4.4: ICMP echo request, id 15288, seq 3129, length 64
> 
> 02:35:22.147449 IP 10.0.2.15 > 8.8.4.4: ICMP echo request, id 15288, seq 3130, length 64
> 02:35:22.347823 IP 10.0.2.15 > 8.8.4.4: ICMP echo request, id 15288, seq 3131, length 64
> 02:35:22.547998 IP 10.0.2.15 > 8.8.4.4: ICMP echo request, id 15288, seq 3132, length 64
> 02:35:22.748066 IP 10.0.2.15 > 8.8.4.4: ICMP echo request, id 15288, seq 3133, length 64
> 02:35:22.948229 IP 10.0.2.15 > 8.8.4.4: ICMP echo request, id 15288, seq 3134, length 64
> 
> 02:35:23.148474 IP 10.0.2.15 > 8.8.4.4: ICMP echo request, id 15288, seq 3135, length 64
> 02:35:23.348846 IP 10.0.2.15 > 8.8.4.4: ICMP echo request, id 15288, seq 3136, length 64
> 02:35:23.549134 IP 10.0.2.15 > 8.8.4.4: ICMP echo request, id 15288, seq 3137, length 64
> 02:35:23.749520 IP 10.0.2.15 > 8.8.4.4: ICMP echo request, id 15288, seq 3138, length 64
> 02:35:23.949819 IP 10.0.2.15 > 8.8.4.4: ICMP echo request, id 15288, seq 3139, length 64
> ```

You're right, the reason only two packets for me was because I changed the timer:
`ping_every=5000`

So after I re-adjust that to 100, now I can have 10 packets per second to measure:
![image](https://user-images.githubusercontent.com/22472752/71437852-4ce0c800-272e-11ea-91ee-556878ba4338.jpeg)

Thank you, again!
