### ISSUE TITLE
Netdata update triggers ipv4.tcphandshake alerts

### ISSUE THREAD

**Issue by PatTheMav** [netdata/netdata#9799]
##### Bug report summary
For a few versions now a scheduled netdata update will lead to `ipv4.tcphandshake` alerts, specifically about a high number (between 66 and 100+) of ipv4 tcp resets received in a 10-second window.

From looking at the system log, the order of events seems to be as follows:

1. Netdata service is restarted after scheduled update
2. The same log line for the ebpf.plugin are repeated about 8 times:

```
ebpf.plugin: Loaded config file '/etc/netdata/apps_groups.conf'
```
3. Alert about tcp resets is sent

##### OS / Environment
```
Linux ***.com 5.4.6-xen #546 SMP Wed Dec 25 17:46:43 CET 2019 x86_64 GNU/Linux
/etc/os-release:PRETTY_NAME="Debian GNU/Linux 10 (buster)"
/etc/os-release:NAME="Debian GNU/Linux"
/etc/os-release:VERSION_ID="10"
/etc/os-release:VERSION="10 (buster)"
/etc/os-release:VERSION_CODENAME=buster
/etc/os-release:ID=debian
/etc/os-release:HOME_URL="https://www.debian.org/"
/etc/os-release:SUPPORT_URL="https://www.debian.org/support"
/etc/os-release:BUG_REPORT_URL="https://bugs.debian.org/"
```

##### Netdata version
netdata v1.24.0-86-nightly 

##### Component Name
(Maybe) ebpf.plugin

##### Steps To Reproduce
1. Have netdata installed
2. Have netdata's automatic updates enabled

##### Expected behavior
Netdata restarts should not trigger tcp reset alerts.

**Comment by thiagoftsm** [comment]
Hi @PatTheMav ,

How did you install your Netdata? I would like to repeat the same steps to be sure I can repeat the error that you are reporting.

In normal situation it is expected that `ebpf.plugin` only collects TCP data, and in a near future we expect it doing UDP requests, considering that we do not have any TCP request inside it, it is possible that is related with other process, please, pay attention for the fact that this is not the final conclusion, I will only have it when I repeat your installation steps. I only wrote some conclusions based in the code we have now.

Best regards!

**Comment by PatTheMav** [comment]
@thiagoftsm Default kickstart script iirc:

```
bash <(curl -Ss https://my-netdata.io/kickstart.sh) --disable-telemetry
```

All I did after was enable/disable my desired plugins.

**Comment by vlvkobal** [comment]
Please make a screenshot of the `ipv4.tcphandshake` chart after Netdata restart.

What is the output of `sudo tcpdump -n 'tcp[tcpflags] & tcp-rst != 0'`?

**Comment by PatTheMav** [comment]
@vlvkobal I finally managed to manually run that restart, here's the info you requested:

```
11:17:10.652095 IP ***.***.***.***.58942 > 35.196.244.138.443: Flags [R], seq 1948163192, win 0, length 0
11:17:10.652181 IP ***.***.***.***.58942 > 35.196.244.138.443: Flags [R], seq 1948163192, win 0, length 0
11:17:10.652465 IP ***.***.***.***.58942 > 35.196.244.138.443: Flags [R], seq 1948163192, win 0, length 0
```

That is the only output from `tcpdump` that seems to be related to the restart, all other entries are external requests coming in to my server (it's a web server). There's also a 5-6 second gap before the next entry, which aligns with this graph:

![2020_08_30-tcp_handshake_chart](https://user-images.githubusercontent.com/9436503/91655741-4a035780-eab3-11ea-8a4c-cfc51b66fc39.jpg)

IIRC 35.196.244.138 is the IP address used for netdata app cloud.

**Comment by thiagoftsm** [comment]
Hi @PatTheMav ,

Firstly I apologize the delay, I was in vacation so I did not have conditions to move forward some tests here.

I observed that you wrote in the issue that the bug could have relationship with ebpf.plugin ( `(Maybe) ebpf.plugin`), but today I started Netdata with `ebpf.plugin` enabled and without to have it `enabled` and for both cases I had more or less the same value in both restarts, so I do not think this has relationship with the plugin.

I also ran Netdata with tcpdump as @vlvkobal required to you, and I observed that I also had connections only for app.netdata.cloud, but the number of connections were far from 500 and it was not enough to raise alarms.

best regards!

**Comment by prologic** [comment]
@PatTheMav Just a _thought_ but do you have something on your machines, network or environments or anywhere along your network paths that might be blocking outbound connections to `app.netdata.cloud` and thereby getting `RST` packets _which may_ be coming from come startup sequences in the agent attempting to talk to Netdata Cloud?

**Comment by PatTheMav** [comment]
@prologic On the hosts themselves no outgoing connections are filtered and as these are virtualised environments I have of course no insight what happens on the actual host, but quick checks do not suggest any filtering of `app.netdata.cloud`. 

Nevertheless this issue happens on _all_ my virtualised hosts after Netdata updates. Sometimes Netdata also doesn't start correctly after an update and gets "stuck" (I have to manually kill all processes associated with netdata and then manually start it to get it back).

**Comment by Xoib** [comment]
Just to to confirm, I got the same alarm when an upgrade has been done automatically.

![image](https://user-images.githubusercontent.com/511705/93182023-7a94f380-f739-11ea-874d-0a9e1f53bf41.png)

DNS logs from the moment Netdata check for a new release to the telegram alert : 

![image](https://user-images.githubusercontent.com/511705/93182241-c0ea5280-f739-11ea-822b-ca0c19261cae.png)

The only thing I do that isn't very common is that I answer NODATA for ipv6 (AAAA) dns request.

**Comment by vlvkobal** [comment]
A short spike after Netdata restart is expected. We will add a 30 sec delay for the alarm raising for [10s_ipv4_tcp_resets_sent](https://github.com/netdata/netdata/blob/master/health/health.d/tcp_resets.conf#L39) and [10s_ipv4_tcp_resets_received](https://github.com/netdata/netdata/blob/master/health/health.d/tcp_resets.conf#L64).
